Link,Title,Location,Summary
https://kr.indeed.com/viewjob?jk=bd007e22541bf6fb,"Customer Engineer, Gaming, Google Cloud",서울,"scripting/programming languages: Java, Go, Kotlin, C#, Python, Perl... Shell Scripting. Ability to rapidly prototype..."
https://kr.indeed.com/viewjob?jk=3c1c5dc51d08cf18,Web / Spring Framework 개발자,서울 금천구,게임>웹프로그래머>JAVA|인터넷·IT·통신·모바일·게임>웹프로그래머> Python|인터넷·IT·통신·모바일·게임>웹프로그래머>ASP|인터넷·IT·통신... 통신·모바일·게임>응용프로그래머> Python|인터넷·IT·통신·모바일·게임...
https://kr.indeed.com/viewjob?jk=2f56d4b70c1df086,하반기 인턴직 모집,서울 을지로2가,"지니어 (IT 인프라 관리/운영) 서버, 네트워크 Bash, Java, Python ① 학력 : 초대졸 이상 (2020년 2월 이후 졸업/졸업예정... JavaScript, VC++, Python) 한솔 PNS IT 부문..."
https://kr.indeed.com/viewjob?jk=fa4286732b7b30d4,"[TmaxAI/R&D] NLP/음성 부문 AI모델 개발자(2022 공개, *전문연구요원 병역특례포함)",성남 분당구,"23년 2월 졸업 예정자 [음성, 자연어처리] -관련 분야의 연구 경험 / 기본 지식 보유자 -기본적인 Python 프로그래밍이 가능하신 분 [감성 분석 / 신사업 솔루션 개발] -머신러닝 및 딥러닝, 언어모델의 종류와..."
https://kr.indeed.com/viewjob?jk=40de6a4b81f8724f,[전문연구요원 신규편입/전직] 의료영상/음성인식/생체신호 연구원,서울 서초구,인공지능)>텍스트마이닝|인터넷·IT·통신·모바일·게임>빅데이터·AI(인공지능)>인공지능(AI)|인터넷·IT·통신·모바일·게임>빅데이터·AI(인공지능)> Python|인터넷·IT·통신·모바일·게임>빅데이터·AI(인공지능)>딥러닝
https://kr.indeed.com/viewjob?jk=e010f7780d479126,검색서비스 서버 개발 신입/경력,서울 관악구,"성별 : 무관 - 모집인원 : 0명 [기술 지원자격] - Linux 환경 개발 경력 - C/Java/ Python 개발 경력 - 서버 개발/운영 경력 [우대사항] - 자연어처리, 정보검색, 기계학습, 데이터 마이닝..."
https://kr.indeed.com/viewjob?jk=35f0a25dee5f3312,딥러닝 알고리즘 및 응용 Engineer,성남 분당구,모바일·게임>빅데이터·AI(인공지능)>인공지능(AI)|인터넷·IT·통신·모바일·게임>빅데이터·AI(인공지능)> Python|인터넷·IT·통신·모바일·게임>빅데이터·AI(인공지능)>머신러닝|인터넷·IT·통신·모바일·게임>빅데이터...
https://kr.indeed.com/viewjob?jk=deb0953e9eebac36,Search Operator,서울 서초구,통신·모바일·게임>빅데이터·AI(인공지능)>데이터분석|인터넷·IT·통신·모바일·게임>빅데이터·AI(인공지능)> Python|인터넷·IT·통신·모바일·게임>빅데이터·AI(인공지능)>머신러닝|인터넷·IT·통신·모바일·게임>빅데이터...
https://kr.indeed.com/viewjob?jk=a3bae7001937a7d9,Data Engineer (토스신용데이터),서울 강남구,환경을 위한 도구를 개발하고 운영해요. 인터넷·IT·통신·모바일·게임>응용프로그래머>JAVA|인터넷·IT·통신·모바일·게임>응용프로그래머> Python|인터넷·IT·통신·모바일·게임>빅데이터·AI(인공지능)>하둡(Hadoop)
https://kr.indeed.com/viewjob?jk=52049395e06b34cb,"백엔드개발자, 모바일앱 개발자, 블록체인 개발자 신입",서울 용산구,"우대사항 AWS 숙련자 php , python, 블록체인 관련 개발 경험자... spring linux SQL [우대요건] AWS 숙련자 php , python, 블록체인 관련 개발 경험자 3명 모바일앱개발(1名) [담당업무..."
https://kr.indeed.com/viewjob?jk=0bee120f408f0bed,Data Engineer (토스뱅크),서울 강남구,"분산처리하여 데이터 기반 토스뱅크 서비스에 기여해요.동료들의 분석환경( Python, SAS, ML 등)을 모두 지원가능한, 쉽게 조회가 가능한 데이터... 통신·모바일·게임>응용프로그래머> Python|인터넷·IT·통신·모바일·게임..."
https://kr.indeed.com/viewjob?jk=655882df0f82eae6,Data Engineer (Elasticsearch),서울 강남구,인터넷·IT·통신·모바일·게임>응용프로그래머>JAVA|인터넷·IT·통신·모바일·게임>응용프로그래머> Python|인터넷·IT·통신·모바일·게임>빅데이터·AI(인공지능)>하둡(Hadoop)|인터넷·IT·통신·모바일·게임>통신...
https://kr.indeed.com/viewjob?jk=dce2abed85cbe3a9,"[삼성동] Application 보안담당자 (5년이상,시니어)",서울 강남구,Global Certification에 대한 이해도가 있으신 분 - Go/ Python 등 프로그래밍에 대한 이해도가 있으신 분 - API / 바이너리... 대한 이해도가 있으신 분- Go/ Python 등 프로그래밍에 대한 이해도가...
https://kr.indeed.com/viewjob?jk=c3f824621815cebe,내비게이션 SW 품질 부문 경력,서울 강남구,모바일·게임>컨텐츠·사이트운영>웹사이트운영·테스터|인터넷·IT·통신·모바일·게임>빅데이터·AI(인공지능)> Python|인터넷·IT·통신·모바일·게임>웹기획·웹마케팅·PM>통계·로그분석|생산·정비·기능·노무>품질관리>품질보증...
https://kr.indeed.com/viewjob?jk=4e27dd1eb77d8bc5,Business Analyst_데이터 분석업무_엔터및 음악 분야 산업,서울,"분석/ 퍼포먼스 분석 유경험자 -데이터 분석 기술/역량 SQL, Python, R, Tableau 등을 이용한 데이터 분석 및 Analysis... Tableau, Python, R, SAS, SPSS, etc.) * 4..."
https://kr.indeed.com/viewjob?jk=16f76581850bcd58,"Solutions Architect II - AWS, Strategic Enterprises",서울,"development languages... Ruby, Python and Node.js Passion for evangelizing... 루비 (Ruby), 파이썬 ( Python), Node.js 등 개발자 및..."
https://kr.indeed.com/viewjob?jk=6141229c69b83068,Web Front-end 개발자,서울 서초구,"Java Script, MariaDB 개발 플랫폼 : Visual Studio Code 우대 사항 : Python, Golang, RESTful API, Node.js, CSS, Docker, AWS, Azure, GCP..."
https://kr.indeed.com/viewjob?jk=948405579172e61a,솔루션기획 신입사원 채용,서울 순화동,"접유형 담당업무 근무지 솔루션기획 (0명) 데이터분석 관련 전공 산업/컴퓨터 공학 전공 R, Python, Microstrategy, Tableau, Power BI 활용 가능자 L-TAB : 인적성진단(온라..."
https://kr.indeed.com/viewjob?jk=069c41d49e087edb,소프트웨어 CTO포지션 [상장예정 스마트 테마파크 스타트업],서울,"Our current major tech stack: • Java, Spring Boot, Nodejs, Python... our backend... major language for backends..."
https://kr.indeed.com/viewjob?jk=dbf097335d890bd0,[신입/경력] 검색서비스개발 담당자,서울 양천구,"무응시자격검색서비스개발신입/경력(1~5년)- 검색데브옵스 개발- 검색서비스 운영- NodeJS, Java, Python, Golang 중 한가지 이상 개발 경험자- Java Spring, Docker, Git, AWS에 대한..."
https://kr.indeed.com/viewjob?jk=287f5f422c269849,Market Research 담당자 채용,서울 중학동,"숙한 대내외 커뮤니케이션이 가능한 분 [우대사항] - 통계분석 및 프로그래밍 언어 역량을 보유하신 분(R, python, Data studio, SPSS, Tableau, etc) - SQL 쿼리사용 가능하신 분 - 영어로..."
https://kr.indeed.com/viewjob?jk=48c56fc0745c828e,D-lab 팀원 모집,서울 여의도,"Spark 등) - Data Pipeline 구성, 모니터링 및 성능 최적화 (Tableau 또는 Python Torch, Tensorflow 등 ML Library와 BI 분석을 위한 데이터 공급) 2) Back..."
https://kr.indeed.com/viewjob?jk=f5a8445589b3e827,마케팅 플랫폼 데이터 엔지니어링 담당자 모집,서울 구로구,"자격요건 - 데이터 엔지니어링 및 인프라 개발/운영 경력 3년 이상 또는 이제 준하는 역량 - Java, Python, Scala 중 1개 이상 사용 가능하신 분 - Hadoop ecosystem(HDFS, Spark..."
https://kr.indeed.com/viewjob?jk=e6f79134827d23a7,데이터분석 전문가 모집,서울 남대문로5가,"Data Studio R Python 담당 직무 11번가 데이터분석팀에... 용한 데이터 시각화 업무 경험이 있으신 분 •데이터 분석을 위한 R, Python등 프로그래밍 언어 활용이 가능하신 분 근무지 서울 스퀘어 지원..."
https://kr.indeed.com/viewjob?jk=62f14dfcbe55b537,"딥러닝, AI(컴퓨터비전)분야 응용 프로그래머 (병역특례 가능)",서울 금천구,Key Word #영상처리 #Computer Vision #머신러닝 #Machine Learning #Object Detection #Semantic Segmentation #딥러닝 #AI #Deep Learning #객체...
https://kr.indeed.com/viewjob?jk=0b4f18b2ea7d2ba1,[TmaxGroup/QA] QA 엔지니어 (2022 공개),성남 분당구,"경력) - Java(Spring), Python - 테스트 자동화 프레임워... 보유자 - 테스트 자동화용 Shell Script 작성 경험자 - Python 사용 경험자 *HyperCloud - K8S 사용 경험자 - 컴퓨터..."
https://kr.indeed.com/viewjob?jk=0c067de742005bfc,Associate Software Engineer (AvionX),서울,"software coding more than 1+ software languages (e.g. C, C++, Python, model based engineering and so on) Proper English..."
https://kr.indeed.com/viewjob?jk=0da8a7bcecfc856d,데이터분석 신입사원 채용,서울 순화동,"우대사항 L-TAB / 면접유형 담당업무 근무지 데이터분석 (0명) 데이터분석 관련 전공 R, Python 활용 가능자 L-TAB : 인적성진단(온라인) 면접유형 : 역량면접, PT면접, 인성면접 데이터..."
https://kr.indeed.com/viewjob?jk=5dd25746d945e947,빅데이터분석 담당자 in 자원순환 모바일 앱 스타트업,서울 성동구,AI(인공지능)>빅데이터|인터넷·IT·통신·모바일·게임>빅데이터·AI(인공지능)>데이터분석|인터넷·IT·통신·모바일·게임>빅데이터·AI(인공지능)> Python|인터넷·IT·통신·모바일·게임>빅데이터·AI(인공지능)>자연어처리
https://kr.indeed.com/viewjob?jk=b4ea95acf92f9cfe,Backend Developer (Python/Junior/2-5년 이하),서울 서초구,"니다.요기요는 국내 최대의 Python 개발 조직으로, 나아가 최고의 개발 조직이 되기 위해 노력합니다. Python 으로 server systems... 다져온 우리의 Python 개발 경험은 새로이 Python 세계에 들어오고..."
https://kr.indeed.com/viewjob?jk=3605c828757eec83,[NAVER Cloud] MLOps 서비스 개발,성남 분당구,"요역량]- 관련 경력 3년이상- Python 또는 Spring 환경에 대한... 작성, Test 자동화 인터넷·IT·통신·모바일·게임>응용프로그래머> Python|인터넷·IT·통신·모바일·게임>웹프로그래머>백엔드|인터넷·IT·통신..."
