Link,Title,Location,Summary
https://kr.indeed.com/viewjob?jk=d6f67adb9feb0f26,"[TmaxMetaverse/R&D] 게임 엔진, 게임 서버, 메타버스 스튜디오, Vision AI 엔진 개발자(2022 공개)",성남 분당구,"개발] - C++ 기반의 개발 경험자 - 멀티쓰레드, 네트워크 프로그래밍 지식 [Vision AI] - Python 기반의 개발 경험자 - Pytorch 및 Tensorflow 기반 Deep learning 모델 연구 경험..."
https://kr.indeed.com/viewjob?jk=cef0ea13108d80c6,IDT 경력 5월,서울 종로구,ABAP|인터넷·IT·통신·모바일·게임>응용프로그래머>JAVA|인터넷·IT·통신·모바일·게임>응용프로그래머> Python|인터넷·IT·통신·모바일·게임>응용프로그래머>인공지능(AI)|재무·회계·경리>세무·회계>SAP BI/BW...
https://kr.indeed.com/viewjob?jk=44f52ea73a6d25da,기술 문서 작성 전문가,성남 분당구,모바일·게임>빅데이터·AI(인공지능)>인공지능(AI)|인터넷·IT·통신·모바일·게임>빅데이터·AI(인공지능)> Python|인터넷·IT·통신·모바일·게임>빅데이터·AI(인공지능)>머신러닝|인터넷·IT·통신·모바일·게임>빅데이터...
https://kr.indeed.com/viewjob?jk=78e99625e5de3c95,전문연구요원 (병역특례) 수시 (AI / HW 분야),성남 분당구,"모델의 RTL IP 설계 및 IP 검증 가능자 - Language: Python/Perl, C/C++ [우대 조건] - ARM based SoC 설계... Linux, shell, tcl, python, perl 사용 원활..."
https://kr.indeed.com/viewjob?jk=c35e9b72a11aa338,[신입/경력] 의료영상/음성인식/생체신호 연구원,서울 서초구,게임>빅데이터·AI(인공지능)>인공지능(AI)|인터넷·IT·통신·모바일·게임>빅데이터·AI(인공지능)>딥러닝|인터넷·IT·통신·모바일·게임>응용프로그래머>C·C++|인터넷·IT·통신·모바일·게임>응용프로그래머> Python
https://kr.indeed.com/viewjob?jk=08e0ca43d0cecb98,[Klaytn] Data Scientist,서울,"협업 및 조언 [ 지원자격 / Qualification ] 기본적인 통계학 및 수학 지식이 있으신 분 Python, SQL에 능숙하신 분 2년 이상의 데이터 분석 경험 커뮤니케이션이 원활하고 함께 일할 줄 아시는 분 문제를..."
https://kr.indeed.com/viewjob?jk=1015284880e2ff62,라인프렌즈 2022년 각 부문 수시,서울 용산구,통신·모바일·게임>웹프로그래머> Python|인터넷·IT·통신·모바일·게임... 자바스크립트|인터넷·IT·통신·모바일·게임>빅데이터·AI(인공지능)> Python|마케팅·광고·홍보·조사>마케팅>마케팅기획|마케팅·광고·홍보·조사>마케...
https://kr.indeed.com/viewjob?jk=2ef118926dc43b32,AI / Big Data 전문가 - 글로벌 전자대기업,서울,통신·모바일·게임>빅데이터·AI(인공지능)>딥러닝|인터넷·IT·통신·모바일·게임>빅데이터·AI(인공지능)> Python|인터넷·IT·통신·모바일·게임>데이터베이스·DBA>데이터사이언스|인터넷·IT·통신·모바일·게임>데이터베이스...
https://kr.indeed.com/viewjob?jk=2a5b207c17d06e56,클라우드 부문 인재,서울 중구,Linux|인터넷·IT·통신·모바일·게임>응용프로그래머>JAVA|인터넷·IT·통신·모바일·게임>응용프로그래머> Python|인터넷·IT·통신·모바일·게임>응용프로그래머>C#|인터넷·IT·통신·모바일·게임>응용프로그래머>ASP...
https://kr.indeed.com/viewjob?jk=8c457f3811ffbf92,[네이버파이낸셜] 데이터 사이언티스트,서울,"해결을 위한 다양한 모델(ML/DL) 개발 [자격요건] - ML/DL 알고리즘에 관한 수학, 통계적 지식 - Python 모델링 library(sklearn, pytorch, tensorflow 등) 사용 경험 [우대사항..."
https://kr.indeed.com/viewjob?jk=67c19d7ac0857ecd,빅데이터 분야,서울,"데이터 분석 모형 개발 ① R, Python, SQL 등 데이터 분석 도구... 분석 관련 자격 보유(빅데이터분석기사, ADsP, ADP 등) - R/ Python/SQL 등을 사용하여 데이터를 핸들링하고 대규모 데이터 셋에서 분석..."
https://kr.indeed.com/viewjob?jk=8190cd1f86a60728,DeepLearning R&D Researcher,서울,"1 ~ 5년 내외 • 자연어 처리(NLP) or 이미지 처리(VISION) 관련 백그라운드를 보유한 분 • Python, C++ 등의 프로그래밍 언어를 1개 이상 자유자재로 다루고 Linux/Shell 환경에 익숙하신 분..."
https://kr.indeed.com/viewjob?jk=64c241d8facd72c6,Python 경력직 개발자 (신한은행 배달앱;땡겨요; 개인화 큐레이션 서비스 운영 개발),서울 중구,직무내용] 담당업무 미식의시대 개인화 큐레이션 서비스 개발 (신한은행 배달앱 땡겨요의 개인화 큐레이션 서비스)자격요건 소프트웨어 엔지니어 경험이 5년 이상이거나 그에 준하는 경험이 있으신 분 개발 생산성에 대해 고민하고 동료...
https://kr.indeed.com/viewjob?jk=5bdbd31484d24289,Data Scientist (토스신용데이터),서울 강남구,이터분석|인터넷·IT·통신·모바일·게임>빅데이터·AI(인공지능)> Python|인터넷·IT·통신·모바일·게임>빅데이터·AI(인공지능)>하둡(Hadoop... 통신·모바일·게임>응용프로그래머> Python|인터넷·IT·통신·모바일·게임...
https://kr.indeed.com/viewjob?jk=b515669e8032265b,[kt ds] 2022년 각 부문별 경력사원 수시,서울 서초구,JAVA|인터넷·IT·통신·모바일·게임>응용프로그래머>C·C++|인터넷·IT·통신·모바일·게임>응용프로그래머> Python|인터넷·IT·통신·모바일·게임>응용프로그래머>자바스크립트|인터넷·IT·통신·모바일·게임>응용프로그래머...
https://kr.indeed.com/viewjob?jk=53c7c22b9dacbbe3,서버 개발자 Python(Django) Developer (경력),서울 마포구,유관직무 경력자 우대 서버 개발자 Python(Django) Developer... 있습니다.■ 자격 요건 인터넷·IT·통신·모바일·게임>웹프로그래머> Python|인터넷·IT·통신·모바일·게임>웹프로그래머>웹개발|인터넷·IT·통신...
https://kr.indeed.com/viewjob?jk=44e123e5f10102f2,각 부문 신입/경력 직원,서울 마포구,통신·모바일·게임>웹프로그래머> Python|인터넷·IT·통신·모바일·게임... 인공지능)> Python|인터넷·IT·통신·모바일·게임>응용프로그래머>인공지능(AI)|인터넷·IT·통신·모바일·게임>응용프로그래머> Python|인터넷...
https://kr.indeed.com/viewjob?jk=8df97f089d8a7d9c,Machine Learning Researcher (Computer Vision),서울,"more than one software language (ex: C, C++, C#, Java, Python, Javascript, Matlab, and so on.) Applicants must have..."
https://kr.indeed.com/viewjob?jk=dd2c5ecf28af4785,영상/음성/청자 인식을 위한 AI Framework 개발자,서울 강서구,"및 제스처를 위한 RF 센서 기반 모델 개발 필요 역량 - C / C++ / Python 언어를 능숙하게 활용할 수 있는 능력 필요 - Python, PyTorch 등 오픈소스 기반 딥 러닝 프레임워크 활용 능력 필요 우대..."
https://kr.indeed.com/viewjob?jk=992f17e9e0140eca,Backend Developer (Python/Senior/6년이상),서울 서초구,"니다.요기요는 국내 최대의 Python 개발 조직으로, 나아가 최고의 개발 조직이 되기 위해 노력합니다. Python 으로 server systems... 다져온 우리의 Python 개발 경험은 새로이 Python 세계에 들어오고..."
https://kr.indeed.com/viewjob?jk=4abf59df14cb4390,서버 개발자 Python(Django) Developer (주니어),서울 마포구,요건- Python/Django 실무 1~3년- RDBMS에 대한 기본 지식- REST API에 대한 기본 지식- AWS 등 클라우드 환경에 대한 관심과 경험 인터넷·IT·통신·모바일·게임>웹프로그래머> Python|인터넷...
https://kr.indeed.com/viewjob?jk=f3c73d17b9f35e27,2022년 AIFFEL AI 인공지능 전문교육,서울 강남구,게임>빅데이터·AI(인공지능)> Python|인터넷·IT·통신·모바일·게임... 로그래머>머신러닝(ML)|인터넷·IT·통신·모바일·게임>응용프로그래머> Python|인터넷·IT·통신·모바일·게임>응용프로그래머>증강현실(AR)|인터넷...
https://kr.indeed.com/viewjob?jk=fcdc3ae2e803744f,"[리얼클래스]백엔드 개발자 (Backend Developer, Python)",서울 강남구,"[프로덕트그룹 소개]퀄슨 프로덕트 그룹은 퀄슨의 연구개발 조직으로, 유저의 학습경험 향상을 위한 제품개발과 운영효율 최적화를 위한 시스템을 만듭니다. 다양한 학습 컨텐츠를 더 나은 환경에서 제공하고, 진단을 통해 학습 효율성을..."
https://kr.indeed.com/viewjob?jk=835324335bc1c7da,[현대무벡스] 경력사원 상시,서울 종로구,ABAP|인터넷·IT·통신·모바일·게임>응용프로그래머>클라우드|인터넷·IT·통신·모바일·게임>응용프로그래머> Python|인터넷·IT·통신·모바일·게임>빅데이터·AI(인공지능)>인공지능(AI)|인터넷·IT·통신·모바일·게임...
https://kr.indeed.com/viewjob?jk=f657ac29e66aa39c,[아도바주식회사] 데이터 분석가,서울 서초구,"핸들링 능력 보유자ㆍ 머신러닝 등 최신 알고리즘을 활용한 실제 비즈니스 문제 해결 경험 보유자ㆍ SQL, Python, R 등 통계/분석 프로그램 능숙자[우대사항]ㆍ 통계학, 수학, 컴퓨터공학 관련 전공 또는 데이터 분석..."
https://kr.indeed.com/viewjob?jk=89da943e9a11af36,각 부문별,서울 서초구,세히보기 FLO 사업 관리 담당자 자세히보기 Data Engineer( Python Backend 경력자) 자세히보기 서비스 기획자(Senior) 자세... 게임>빅데이터·AI(인공지능)> Python|인터넷·IT·통신·모바일·게임...
https://kr.indeed.com/viewjob?jk=a1913552450fe69c,[진행중] AI사업부 전문직(인공지능[AI] 모델링 자연어처리) 채용공고,서울 회현동,"이상 충족) - NLP, TA(Text Analysis) 등 자연어 처리 관련 프로젝트 경험 보유 - Python, R 등 프로그래밍 활용 역량 보유 - 딥러닝 프레임워크(Tensorflow, PyTorch 등) 기반..."
https://kr.indeed.com/viewjob?jk=5ea9ea023c6ccc03,"S/W 엔지니어, 데이터분석 신입/경력 정규직, 인턴",성남 분당구,"케이션 제작 및 유지보수 업무- Python, Golang, QT 중 선택... 2. 시스템프로그래머- Python, Golang, QT 중 선택 가능3. 영상데이터 분석 및 모델링- python기반 영상데이터 분석 및 모델링..."
https://kr.indeed.com/viewjob?jk=d364360d1e0368e3,Python 기반 빅데이터 처리 개발자,서울 서초구,인터넷·IT·통신·모바일·게임>응용프로그래머> Python|인터넷·IT·통신·모바일·게임>빅데이터·AI(인공지능)> Python|인터넷·IT·통신·모바일·게임>빅데이터·AI(인공지능)>빅데이터|인터넷·IT·통신·모바일·게임...
https://kr.indeed.com/viewjob?jk=cdf77590ecd833dc,UX Researcher (정량/포트폴리오 없는 전형),서울 강남구,최적의 방법으로 사용자의 패턴을 정량적으로 분석해요. 인터넷·IT·통신·모바일·게임>웹디자인>UI·UX디자인|인터넷·IT·통신·모바일·게임>데이터베이스·DBA>SQL|인터넷·IT·통신·모바일·게임>응용프로그래머> Python
https://kr.indeed.com/viewjob?jk=2d2659757e9ac7fb,[Creative] Cinematic FX Artist (3년 이상),서울 강남구,터넷·IT·통신·모바일·게임>게임(Game)>게임 기획|인터넷·IT·통신·모바일·게임>게임(Game)>게임디자인|인터넷·IT·통신·모바일·게임>응용프로그래머>C·C++|인터넷·IT·통신·모바일·게임>응용프로그래머> Python
https://kr.indeed.com/viewjob?jk=44e9ac7f0f94e784,한국필립모리스 2022년 상반기 수시,서울 영등포구,통신·모바일·게임>웹프로그래머> Python|인터넷·IT·통신·모바일·게임... 용프로그래머>자바스크립트|인터넷·IT·통신·모바일·게임>응용프로그래머> Python|인터넷·IT·통신·모바일·게임>시스템프로그래머>펌웨어·어셈블러|인터...
https://kr.indeed.com/viewjob?jk=fbc6af4e663e40db,데이터분석가 - Global Leading Consulting Firm,서울,모바일·게임>빅데이터·AI(인공지능)>데이터분석|인터넷·IT·통신·모바일·게임>빅데이터·AI(인공지능)> Python|인터넷·IT·통신·모바일·게임>빅데이터·AI(인공지능)>인공지능(AI)|마케팅·광고·홍보·조사>조사·분석...
https://kr.indeed.com/viewjob?jk=36909585ee88468b,2022년 하반기 인턴십(채용연계형),서울,기본적인 CS지식을 보유하고 있는 분 • Git을 통한 협업 경험과 Code Review 익숙하신 분 • Python 사용 경험이 있으신 분 • 기술문제를 깊이 분석하고 기술적 방법으로 문제를 해결하는 경험을 갖춘 분 우대...
https://kr.indeed.com/viewjob?jk=abdc136f65ceddd4,AI 분야,서울,"무를 경험하면서 조직과 함께 성장하고 싶으신 마인드를 보유하신 분 - Python 및 PyTorch, Tensorflow 등과 같은 딥러닝 프레임워크... 경력자 가능 - C/C++, Python, 딥러닝 프레임워크(PyTorch..."
https://kr.indeed.com/viewjob?jk=dc3dc2bda2f740fe,[BATTLEGROUNDS] Anti-Cheat Data Scientists (2년 이상),서울 서초구,AI(인공지능)> Python|인터넷·IT·통신·모바일·게임>빅데이터·AI(인공지능)>머신러닝|인터넷·IT·통신·모바일·게임>ERP·시스템분석·설계>데이터분석|인터넷·IT·통신·모바일·게임>응용프로그래머> Python|인터넷...
https://kr.indeed.com/viewjob?jk=4d6fa0f1b9726d7c,디지털 미디어 매니저(퍼포먼스&브랜딩) 신입/경력,서울 서초구,[우대 요건] 1) 마케팅 전공자 2) 영어 커뮤니케이션 가능자 3) Python을 통한 프로그래밍 가능자 4) 구글 및 페이스북 셀프서브 가능자 5) GA 및 써드파티 트래커 활용 가능자 마케팅·광고·홍보·조사>마케팅>온라인마케팅
https://kr.indeed.com/viewjob?jk=1e7271e69ef269da,"JAVA, Python, R, C, C++ 외 신입/경력 개발자 정규직",서울 강남구,"(주)이지서티 JAVA, Python, C, C++, C#임베디드... 게임>웹프로그래머>JAVA|인터넷·IT·통신·모바일·게임>웹프로그래머> Python|인터넷·IT·통신·모바일·게임>웹프로그래머>백엔드|인터넷·IT·통신..."
https://kr.indeed.com/viewjob?jk=78e00ca5ba2d1d71,컴퓨터비전 개발자 경력 정규직,서울 성동구,바일·게임>빅데이터·AI(인공지능)>인공지능(AI)|인터넷·IT·통신·모바일·게임>빅데이터·AI(인공지능)> Python|인터넷·IT·통신·모바일·게임>소프트웨어·하드웨어>소프트웨어|인터넷·IT·통신·모바일·게임>응용프로그래머>C·C++
https://kr.indeed.com/viewjob?jk=5a50c5d2a639b6fe,Data Engineer & Scientist,서울 영등포구,"Athena, Google Firebase/BigQuery 등) - Unix/Linux 환경 경험 - 3년 이상 Python/R/SQL/NoSQL Scripting Language 사용 및 협업 경험 우대사항 - 엔터프라이즈..."
https://kr.indeed.com/viewjob?jk=96677a787548c160,[크립토랩] 동형암호 프레임워크 이용한 파이썬 기반 동형 통계함수 개발 인턴,서울 관악구,하여 글로벌 시장 매출을 확보해 나가고 있습니다. 모집부문 및 자격요건 담당업무 자격요건 인원 [담당업무]ㆍ Python 동형암호 프레임워크 학습ㆍ개발 대상 통계함수 학습 및 코드 개발 준비 인터넷·IT·통신·모바일·게임>전산...
https://kr.indeed.com/viewjob?jk=7a5f894a986d3015,Sr.SCM (Inventory Planning Control),서울,"세스/시스템 개선 리드 자격 요건: 물류/SCM, 엔지니어링 분야 학사 이상 데이터 분석역량(SQL, Python, R 등) 5년 이상 SCM/물류 관련 분야 경력 프로세스 개선/생산성 개선관련 프로젝트 리드경험 및 개선..."
https://kr.indeed.com/viewjob?jk=7b7030fa29130657,"[신입,경력] 스마트 교통시스템 임베디드 소프트웨어 개발자",서울 구로구,"비젼, 영상 처리, 딥러닝 알고리즘 2) 사용 언어 : C, C++, Python 3) TensorFlow, Deep Learning 관련 지식 보유... 드웨어>소프트웨어|인터넷·IT·통신·모바일·게임>응용프로그래머> Python"
https://kr.indeed.com/viewjob?jk=8b6dbee8628c6409,백엔드 경력 정규직,서울 성동구,대학교(4년)졸업• 전공계열: 공학계열[다루는 프로그래밍 언어]• Python Django 또는 JAVA Spring[필수조건 (아래 조건 중 최소... 통신·모바일·게임>웹프로그래머> Python|인터넷·IT·통신·모바일·게임...
https://kr.indeed.com/viewjob?jk=f7e1a723c4af504f,"Game Operations Specialist, Pico",서울,independently promote business development... SQL or python as a plus 6. Have keen insight and strong learning ability...
https://kr.indeed.com/viewjob?jk=b9e4855cb0d16af8,하드웨어 및 펌웨어 개발자 (초급 및 중급),서울 성동구,업기사- C#/ Python Programming 가능- IoT 단말 개발- 리눅스 환경 개발#중급 우대사항- 전공 : 전자공학/정보처리/통신 관련학과- 자격증 : 정보처리기사/산업기사- C#/ Python Programming...
https://kr.indeed.com/viewjob?jk=bf39c8f95f1bdf47,"데이터 분석 위한 신입 프로그래머(Java, Python)",서울 영등포구,"Java, JSP, R, Python, 각종 DB 가능자와 AI경험자 및 영어능통자를 우대합니다.(DB기본기, js, Python, Django... 대합니다.- AI(ML, DL, Python, R 등)에 유능한 분을 우대..."
https://kr.indeed.com/viewjob?jk=40dd2b0d289f3734,"JAVA, Python 외 경력 정규직",서울 중구,인터넷·IT·통신·모바일·게임>응용프로그래머>JAVA|인터넷·IT·통신·모바일·게임>웹프로그래머> Python|인터넷·IT·통신·모바일·게임>데이터베이스·DBA>SQL
https://kr.indeed.com/viewjob?jk=df21e3bb5d773616,Python Programmer,서울 서초구,개발 – JAVA 프로그래밍(라이브러리 활용) – Spring 프레임 워크 개발 – Python API 프로그래밍 우대사항 – Python 개발 경험 – Open Source 라이브러리 개발경험 – Web 표준에 대한 경험...
https://kr.indeed.com/viewjob?jk=a9edbfb5b7ce844e,2022년도 2차 직원,충청북도 음성,웹프로그래머> Python|인터넷·IT·통신·모바일·게임>웹프로그래머>웹개발|인터넷·IT·통신·모바일·게임>응용프로그래머> Python|인터넷·IT·통신·모바일·게임>빅데이터·AI(인공지능)> Python|인터넷·IT·통신·모바일...
https://kr.indeed.com/viewjob?jk=94da06451e75b402,DBA (토스신용데이터),서울 강남구,모바일·게임>데이터베이스·DBA>SQL|인터넷·IT·통신·모바일·게임>데이터베이스·DBA>MySQL|인터넷·IT·통신·모바일·게임>데이터베이스·DBA>Oracle DB|인터넷·IT·통신·모바일·게임>응용프로그래머> Python
https://kr.indeed.com/viewjob?jk=91f00552e76ed29e,QA/테스터 엔지니어 계약직/인턴 (정규직 전환 가능),서울 중구,"있으신 분• Kurbernetes, Docker와 같은 컨테이너 환경에 익숙하거나 개발 경험이 있으신 분• Python, Javascript 등의 스크립트 언어 사용 경험이 있으신 분 1 명 근무조건 고용형태: 계약직(근무기..."
https://kr.indeed.com/viewjob?jk=b5f09ca5fc20b34a,웹프로그래머 (FrontEnd) 기업부설연구소 연구원 #python #js #FullStack #모바일,서울 용산구,"데이터 수집, 분석 및 가공 에 관련된 프로그램 개발 ( Python) REST API개발( Python)# 우대사항 javascript 개발경험 필수 python 개발 유경험자 우대 Android, iOS 개발 유경험자 우대..."
https://kr.indeed.com/viewjob?jk=303d8c644a5f2e0f,DNN 모델 개발 엔지니어,성남 분당구,통신·모바일·게임>빅데이터·AI(인공지능)>비전인식|인터넷·IT·통신·모바일·게임>빅데이터·AI(인공지능)> Python|인터넷·IT·통신·모바일·게임>빅데이터·AI(인공지능)>머신러닝|인터넷·IT·통신·모바일·게임>빅데이터...
https://kr.indeed.com/viewjob?jk=bb6ec1db50a20eac,Applied Scientist,서울,"e.g. IOT Security, Linux Security) · Experience with Python, shell scripting and R · Master’s degree in Computer Science..."
https://kr.indeed.com/viewjob?jk=287a2f9783758916,한국행동과학연구소 각 부문 수시,서울 강남구,"CSS3, 모바일 프로젝트 및 반응형 웹구축 경험, 교육이수자 백엔드개발자 - 개발 및 유지보수 - java, python, php, nodejs 사용자- oracle, mysql 등 유경험자 근무조건 경영·인사·총무·사무..."
https://kr.indeed.com/viewjob?jk=3b7dbdf85a326a6d,국내 대기업 - AI 및 딥러닝 관련 경력자,서울,"관련 전문 지식 있는 분 - Python 또는 Scala, JAVA 활용... 레임워크 활용 역량 좋은 분- 자연어처리 관련 전문 지식 있는 분- Python 또는 Scala, JAVA 활용 역량- 미디어/커머스/전자/IT 업계..."
https://kr.indeed.com/viewjob?jk=bfe0f5ac4f32ec89,추천 통계분석/데이터사이언티스트 모집,성남 판교역,"통계, 수학 관련 분야의 석사 또는 박사 학위 소지자 숙련된 데이터분석 능력 데이터 사이언스를 위한 언어( Python/R) 를 하나 이상 능숙하게 다룰 수 있으신 분 분석 결과를 설득력있게 전달할 수 있는 분 우대사항..."
https://kr.indeed.com/viewjob?jk=914e8ceceb14f5c9,"Customer Delivery Architect, Professional Services",서울,"automation through DevOps scripting (E.g. shell, Python, Ruby, Powershell) • Demonstrated ability to adapt to new..."
https://kr.indeed.com/viewjob?jk=36089807638eb8cb,Backend Engineer,서울,"학사 이상 업무 영어 회화 우대 조건 React.JS, Redis 개발 경험 TypeScript, Python 개발 경험 ZMQ, gRPC, Protobuf 등 원격 마이크로 서버 개발 경험 Linux/Unix 시스템..."
https://kr.indeed.com/viewjob?jk=e990d9ecc91ca7a7,Modelling & Simulation (M&S) Software Engineer,서울,"JavaScript, CSS3, ASP.Net, Java, JSP, Python, SQL, Linux, Apache, Mysql, and PHP... programing languages: Python, JavaScript..."
https://kr.indeed.com/viewjob?jk=3569cddb459c3fb8,"Partner Solutions Engineer, YouTube (English, Korean)",서울,"Experience using one or more... following: Java, Python, PHP, XML, HTTP, HTML... JavaScript Experience with data..."
https://kr.indeed.com/viewjob?jk=1e1065cce8bea997,[NAVER Cloud] MongoDB 데이터베이스 엔지니어 (DBA),성남 분당구,"데이터베이스 설계, 구축, 운영, 트러블 슈팅 능력- Backend 프로그래밍 협업 능력 (Node.js, Python 등)[우대사항]- 뜻있는 개발자 출신 DBA 우대- 대규모/대용량 DB 운영환경을 경험하신 분<sp 인터..."
https://kr.indeed.com/viewjob?jk=3cd339cf8959f44d,생명정보학 부문 박사졸 선임연구원 정규직 정규직,서울 서대문구,"- Python or R 활용가능 -Linux terminal 능숙 -생물학... 생명정보학, 생물정보학-외국어: 영어 회화가능,독해가능,작문가능- Python or R 활용가능- Linux terminal 능숙- 생물학 기초 수강..."
https://kr.indeed.com/viewjob?jk=e684cb2d1a258175,[KREAM] Server 개발자,성남 분당구,합니다. 인터넷·IT·통신·모바일·게임>응용프로그래머>API|인터넷·IT·통신·모바일·게임>응용프로그래머> Python|인터넷·IT·통신·모바일·게임>게임(Game)>서버·네트워크개발|인터넷·IT·통신·모바일·게임>ERP·시스...
https://kr.indeed.com/viewjob?jk=2642a83874ea6bab,"영상처리, 컴퓨터 비전 전문가 (신입/경력)",성남 수정구,"인원 [담당업무] Python, C++, MFC, C를 이용하여 - OpenCV 로 Visual SLAM 개발- MFC, Python을 이용하여 GUI... 통신·모바일·게임>응용프로그래머> Python|인터넷·IT·통신·모바일·게임..."
https://kr.indeed.com/viewjob?jk=6d0b76f65c7a3c32,(주)엘솔루 R&D본부 ASR팀 개발직,서울,터넷·IT·통신·모바일·게임>응용프로그래머>JAVA|인터넷·IT·통신·모바일·게임>응용프로그래머>Linux|인터넷·IT·통신·모바일·게임>응용프로그래머>머신러닝(ML)|인터넷·IT·통신·모바일·게임>응용프로그래머> Python
https://kr.indeed.com/viewjob?jk=c5a2d42f245aade7,[신입/경력] 데이터개발 담당자,서울 양천구,"End 개발 경력 2년 이상- Python, Java 중 한가지 언어를... 인공지능)> Python|인터넷·IT·통신·모바일·게임>ERP·시스템분석·설계>빅데이터|인터넷·IT·통신·모바일·게임>응용프로그래머> Python|인터넷..."
https://kr.indeed.com/viewjob?jk=649ccf047c868778,"금융 데이터 분석 엔진, 로보어드바이저 개발자",서울 영등포구,"시스템, 머신러닝, 자연어처리. 패턴분석 - 다음 언어에서 최소 한 가지 이상 능숙자: Java, C++, Python, JavaScript 우대사항 - 석사이상 컴퓨터공학 (Computer Science) 분야 또는..."
https://kr.indeed.com/viewjob?jk=af5683389907a8c9,백엔드 개발자 (경력),서울 역삼동,"데이터 관리 (Auth0) - 블록체인 지갑 인증 (Ethereum, EOS) [자격요건] - 백엔드 & Python 실무 개발경험 3년 이상 혹은 그에 준하는 능력을 갖고 있으신 분 - 새로운 기술에 대해 호기심을 갖고..."
https://kr.indeed.com/viewjob?jk=abff6140709d8375,Business Analyst,서울 서초구,비롯한 SQL• Tableau• Python 인터넷·IT·통신·모바일·게임... 데이터·AI(인공지능)> Python|인터넷·IT·통신·모바일·게임>데이터베이스·DBA>SQL|인터넷·IT·통신·모바일·게임>응용프로그래머> Python
https://kr.indeed.com/viewjob?jk=e85487d0d81b009b,시스템보안 담당자 채용,서울 중학동,"경험 보유 우대사항 - AWS, Azure 등 클라우드 환경의 보안서비스 운영 경험자 - Java, Python 등 프로그래밍 언어 능숙자 근무조건 [근무조건] - 근무형태 : 정규직 - 모집인원 : 명 - 근무지..."
